{
  "schemaVersion": "oluk.product-content.v1",
  "registryId": "OLUK-PRODUCT-CONTENT-001",
  "publicationState": "CANDIDATE_HUMAN_REVIEW_REQUIRED_UNPUBLISHED",
  "authorityStates": [
    "CONTENT_READY",
    "SOURCE_BOUND",
    "PENDING_EVIDENCE_BINDING",
    "EDITORIAL_CHOICE"
  ],
  "sourceLayers": [
    "LABEL",
    "FINAL_TRANSPARENT_RENDER",
    "OPENLAB_JANOSHIK",
    "WOO_C2",
    "APPROVED_EDITORIAL",
    "FIGMA_SITES_COMPOSITION"
  ],
  "contractLaw": {
    "contentAtomLaw": "Every non-null atom names field-level provenance bindings and explicit constraints. Null means omit or show an unavailable state; consumers must never infer a value.",
    "analyticalClaimOwner": "OPENLAB_JANOSHIK",
    "commerceOwner": "WOO_C2",
    "visualFactOwners": ["LABEL", "FINAL_TRANSPARENT_RENDER"],
    "compositionOwner": "FIGMA_SITES_COMPOSITION",
    "forbiddenCustomerContent": [
      "UNBOUND_MEDICAL_CLAIMS",
      "DOSAGE_OR_USAGE_INSTRUCTIONS",
      "UNBOUND_PERFORMANCE_OR_OUTCOME_CLAIMS",
      "UNBOUND_PURITY_OR_ANALYTICAL_CLAIMS",
      "PROVIDER_FILE_STATUS_WITHOUT_SOURCE_RECORD",
      "STATIC_PRICE",
      "STATIC_INVENTORY",
      "STATIC_PURCHASABILITY",
      "SCHEMA_COMMERCE_DATA_FROM_CONTENT_FIXTURES"
    ]
  },
  "products": [
    {
      "canonicalProductId": "mk-2866",
      "slug": "mk-2866",
      "readinessState": "CONTENT_READY",
      "canonicalIdentity": {
        "name": {
          "value": "MK-2866",
          "state": "CONTENT_READY",
          "provenanceBindingIds": ["BIND-MK2866-LABEL"],
          "constraints": ["PRESERVE_EXACT_HYPHENATION"]
        },
        "aliases": [
          {
            "value": "Ostarine",
            "kind": "COMMON",
            "state": "CONTENT_READY",
            "provenanceBindingIds": ["BIND-MK2866-LABEL"],
            "constraints": ["PRESENT_AS_ALIAS_NOT_SEPARATE_PRODUCT"]
          }
        ]
      },
      "media": {
        "render": {
          "value": "/assets/products/mk-2866/front.png",
          "state": "CONTENT_READY",
          "provenanceBindingIds": ["BIND-MK2866-FINAL-RENDER"],
          "constraints": ["USE_CONFIRMED_TRANSPARENT_RENDER", "DO_NOT_REDRAW_OR_RELABEL"]
        }
      },
      "content": {
        "customerThesis": {
          "value": "Choose MK-2866 by its labelled format and available batch record, with product facts and source-reported evidence kept clearly separated.",
          "state": "CONTENT_READY",
          "provenanceBindingIds": ["BIND-MK2866-LABEL", "BIND-MK2866-OPENLAB", "BIND-GLOBAL-EDITORIAL-SAFETY"],
          "constraints": ["NEUTRAL_DECISION_COPY_ONLY", "NO_PERFORMANCE_OR_MEDICAL_PROMISE"]
        },
        "descriptions": {
          "short": {
            "value": "MK-2866 (Ostarine) is a SARM Series product in a 15 MG, 90-serving format.",
            "state": "CONTENT_READY",
            "provenanceBindingIds": ["BIND-MK2866-LABEL"],
            "constraints": ["FACTUAL_LABEL_SUMMARY_ONLY"]
          },
          "medium": {
            "value": "MK-2866 (Ostarine) is a SARM Series product in a 15 MG, 90-serving format. Its available OpenLab record connects batch OL2201 to Janoshik report 28868 and presents source-reported analytical values.",
            "state": "CONTENT_READY",
            "provenanceBindingIds": ["BIND-MK2866-LABEL", "BIND-MK2866-OPENLAB"],
            "constraints": ["KEEP_LABEL_FACTS_SEPARATE_FROM_REPORTED_VALUES", "NO_PERFORMANCE_OR_MEDICAL_PROMISE"]
          },
          "long": {
            "value": "MK-2866, also identified as Ostarine, is presented in the SARM Series as a 15 MG capsule format with 90 servings. The available OpenLab record for batch OL2201 links to Janoshik report 28868, dated 16 April 2023. That named report records reported purity above 99% and a reported concentration of 16.02 mg against the 15 mg label claim.",
            "state": "CONTENT_READY",
            "provenanceBindingIds": ["BIND-MK2866-LABEL", "BIND-MK2866-OPENLAB"],
            "constraints": ["RETAIN_REPORTED_QUALIFIER", "DO_NOT_GENERALIZE_ONE_BATCH", "NO_PERFORMANCE_OR_MEDICAL_PROMISE"]
          }
        },
        "facts": {
          "series": {"value": "SARM SERIES", "state": "CONTENT_READY", "provenanceBindingIds": ["BIND-MK2866-LABEL"], "constraints": ["PRESERVE_EXACT_LABEL_CASE"]},
          "sku": {"value": "80529-01", "state": "CONTENT_READY", "provenanceBindingIds": ["BIND-MK2866-LABEL"], "constraints": ["IDENTITY_ONLY_NOT_COMMERCE_LOOKUP_AUTHORITY"]},
          "strength": {"value": "15 MG", "state": "CONTENT_READY", "provenanceBindingIds": ["BIND-MK2866-LABEL"], "constraints": ["LABEL_FACT_NOT_DOSAGE_INSTRUCTION"]},
          "servings": {"value": "90 SERVINGS", "state": "CONTENT_READY", "provenanceBindingIds": ["BIND-MK2866-LABEL"], "constraints": ["NEVER_REPLACE_WITH_90_CAPS"]},
          "purity": {"value": ">99%", "state": "CONTENT_READY", "provenanceBindingIds": ["BIND-MK2866-LABEL", "BIND-MK2866-OPENLAB"], "constraints": ["DISPLAY_AS_LABEL_OR_SOURCE_REPORTED_FACT", "DO_NOT_GENERALIZE_BEYOND_BOUND_RECORD"]},
          "form": {"value": "CAPSULES", "state": "CONTENT_READY", "provenanceBindingIds": ["BIND-MK2866-LABEL"], "constraints": ["FORM_ONLY_NOT_DOSAGE_INSTRUCTION"]}
        },
        "composition": {
          "value": "Label-backed detail is limited to MK-2866 as the named compound and capsules as the form; excipients and the full formula are unavailable.",
          "state": "CONTENT_READY",
          "provenanceBindingIds": ["BIND-MK2866-LABEL", "BIND-GLOBAL-EDITORIAL-SAFETY"],
          "constraints": ["DO_NOT_CALL_THIS_A_COMPLETE_FORMULA", "OMIT_EXCIPIENTS_UNTIL_LABEL_BOUND"]
        },
        "useContext": {
          "value": "Compare the labelled format, serving count and available source record when reviewing this product.",
          "state": "CONTENT_READY",
          "provenanceBindingIds": ["BIND-MK2866-LABEL", "BIND-MK2866-OPENLAB", "BIND-GLOBAL-EDITORIAL-SAFETY"],
          "constraints": ["DECISION_CONTEXT_ONLY", "NO_DOSAGE_OR_USAGE_INSTRUCTION"]
        },
        "claimsConstraints": {
          "value": ["NO_MEDICAL_CLAIMS", "NO_DOSAGE_OR_USAGE_INSTRUCTIONS", "NO_PERFORMANCE_OR_OUTCOME_PROMISES", "RETAIN_REPORTED_QUALIFIER_FOR_ANALYTICAL_VALUES", "NO_STATIC_COMMERCE_STATE"],
          "state": "CONTENT_READY",
          "provenanceBindingIds": ["BIND-GLOBAL-EDITORIAL-SAFETY", "BIND-MK2866-OPENLAB", "BIND-GLOBAL-WOO-C2-RESOLVER"],
          "constraints": ["APPLIES_TO_EVERY_ROUTE_VARIANT"]
        },
        "evidence": {
          "availability": {"value": "AVAILABLE", "state": "CONTENT_READY", "provenanceBindingIds": ["BIND-MK2866-OPENLAB"], "constraints": ["ONLY_FOR_BOUND_RECORD_REPORT_28868"]},
          "summary": {"value": "The available record connects batch OL2201 to Janoshik report 28868 and displays source-reported values.", "state": "CONTENT_READY", "provenanceBindingIds": ["BIND-MK2866-OPENLAB"], "constraints": ["RETAIN_SOURCE_REPORTED_WORDING", "NO_VERIFIED_PERFORMANCE_LANGUAGE"]},
          "statements": [
            {"value": "Janoshik report 28868 records reported purity above 99% for batch OL2201.", "state": "CONTENT_READY", "provenanceBindingIds": ["BIND-MK2866-OPENLAB"], "constraints": ["REPORT_SPECIFIC", "DO_NOT_GENERALIZE"]},
            {"value": "The same record reports a concentration of 16.02 mg against the 15 mg label claim.", "state": "CONTENT_READY", "provenanceBindingIds": ["BIND-MK2866-OPENLAB", "BIND-MK2866-LABEL"], "constraints": ["REPORT_SPECIFIC", "NOT_A_PERFORMANCE_SCORE"]},
            {"value": "The named record is dated 16 April 2023.", "state": "CONTENT_READY", "provenanceBindingIds": ["BIND-MK2866-OPENLAB"], "constraints": ["PRESERVE_SOURCE_DATE"]}
          ]
        },
        "seo": {
          "titleBase": {"value": "MK-2866 (Ostarine) 15 MG | Olympus Labs UK", "state": "CONTENT_READY", "provenanceBindingIds": ["BIND-MK2866-LABEL"], "constraints": ["NO_PRICE_STOCK_OR_PERFORMANCE_TERM"]},
          "descriptionBase": {"value": "Explore MK-2866 (Ostarine), a 15 MG, 90-serving SARM Series format, with access to its available OpenLab batch record.", "state": "CONTENT_READY", "provenanceBindingIds": ["BIND-MK2866-LABEL", "BIND-MK2866-OPENLAB"], "constraints": ["NO_UNBOUND_ANALYTICAL_VALUE", "NO_STATIC_COMMERCE_STATE"]},
          "focusTerms": {"value": ["MK-2866", "Ostarine", "15 MG", "90 servings", "OpenLab"], "state": "CONTENT_READY", "provenanceBindingIds": ["BIND-MK2866-LABEL", "BIND-MK2866-OPENLAB"], "constraints": ["KEYWORDS_DO_NOT_AUTHORIZE_CLAIMS"]}
        },
        "bundleStack": {
          "positioning": {"value": null, "state": "EDITORIAL_CHOICE", "provenanceBindingIds": [], "constraints": ["OMIT_UNTIL_EDITORIALLY_APPROVED"]},
          "relationships": {"value": ["gw-501516", "s-4", "lgd-4033"], "state": "EDITORIAL_CHOICE", "provenanceBindingIds": ["BIND-EDITORIAL-MK2866"], "constraints": ["NOT_CUSTOMER_READY", "REQUIRES_TYPED_CUSTOMER_REASON", "NO_SYNERGY_OR_EFFECTIVENESS_CLAIM"]}
        },
        "faqs": [
          {
            "question": {"value": "What product facts are available for MK-2866?", "state": "CONTENT_READY", "provenanceBindingIds": ["BIND-MK2866-LABEL"], "constraints": ["NEUTRAL_CUSTOMER_QUESTION"]},
            "answer": {"value": "MK-2866 is labelled as Ostarine in the SARM Series, with a 15 MG format and 90 servings.", "state": "CONTENT_READY", "provenanceBindingIds": ["BIND-MK2866-LABEL"], "constraints": ["LABEL_FACTS_ONLY"]}
          },
          {
            "question": {"value": "Is there an OpenLab record for MK-2866?", "state": "CONTENT_READY", "provenanceBindingIds": ["BIND-MK2866-OPENLAB"], "constraints": ["NEUTRAL_CUSTOMER_QUESTION"]},
            "answer": {"value": "Yes. The available record connects batch OL2201 to Janoshik report 28868 and displays source-reported values.", "state": "CONTENT_READY", "provenanceBindingIds": ["BIND-MK2866-OPENLAB"], "constraints": ["RECORD_SPECIFIC", "RETAIN_SOURCE_REPORTED_WORDING"]}
          },
          {